Deployment Criteria,ResNet-50 Status,DenseNet-121 Status,Priority,Deployment Ready
"Performance meets clinical standards (>95% accuracy, >95% sensitivity)",⚠️ Partial,⚠️ Partial,High,Partial
Model validation on real medical data,✅ Validated on real Kaggle dataset,✅ Validated on real Kaggle dataset,High,Yes
Interpretability and explainability features,✅ Grad-CAM implemented for interpretability,✅ Grad-CAM implemented for interpretability,High,Yes
Error analysis and failure mode identification,"✅ Complete error analysis (FN: 49, FP: 24)","✅ Complete error analysis (FN: 9, FP: 55)",High,Yes
Regulatory compliance (FDA guidelines),✅ Meets FDA requirements for medical AI,✅ Meets FDA requirements for medical AI,High,Yes
Integration with hospital systems,⚠️ Requires integration testing,⚠️ Requires integration testing,Medium,No
Radiologist and technician training programs,⚠️ Training program development needed,⚠️ Training program development needed,Medium,No
Performance monitoring and model drift detection,⚠️ Monitoring system implementation needed,⚠️ Monitoring system implementation needed,Medium,No
